question,answer
What is the minimum age requirement for a loan?,The minimum age requirement for a loan is 18 years old.
What is the maximum loan amount offered?,"The maximum loan amount offered is $40,000."
What is the typical income requirement for a loan?,"The typical income requirement for a loan is $40,000."
How long does it take to process a loan application?,It typically takes 1-2 weeks to process a loan application.
What is the gender distribution among loan applicants?,The gender distribution among loan applicants is balanced.
Are there any special discounts for women applicants?,"Yes, there are special discounts available for women applicants."
What is the approval rate for loan applications?,The approval rate for loan applications is 100%.
Can I apply for a loan with a bad credit score?,"Yes, you can still apply for a loan with a bad credit score, but approval is not guaranteed."
Is there a penalty for early loan repayment?,"No, there is no penalty for early loan repayment."
Are there any additional fees associated with loans?,"Yes, there may be additional processing fees associated with loans."
Can I apply for a loan online?,"Yes, you can apply for a loan online through our website."
What is the interest rate for loans?,The interest rate for loans varies depending on various factors. It typically ranges from 5% to 10%.
How much documentation is required for a loan?,"The documentation required for a loan includes proof of identity, income statements, and address proof."
Can I apply for multiple loans simultaneously?,"Yes, you can apply for multiple loans simultaneously, but each application will be evaluated independently."
What is the average loan processing time?,The average loan processing time is 7-10 business days.
Do you offer personal loan services?,"Yes, we offer personal loan services."
